{
  "schemaVersion": 1,
  "id": "day-rhythm-demo",
  "title": "我的一天，如何更有節奏？",
  "description": "從一個虛構的放學情境，練習觀察、選擇與說明理由。體驗投票、量尺、短答和即時回饋。",
  "subject": "健康教育・功能示範",
  "duration": 20,
  "objectives": ["從情境找出需要考量的資訊", "比較選擇並說明理由", "聆聽不同觀點，修正自己的想法"],
  "slides": [
    {
      "id": "welcome",
      "eyebrow": "01 / 今天的練習",
      "title": "留一點空間，給更好的選擇。",
      "body": "今天不需要分享自己的健康隱私。我們一起幫虛構人物小宇，想一想放學後的安排。",
      "bullets": ["先觀察情境", "再提出選擇", "最後說明理由"],
      "visual": "balance",
      "notes": "這是框架功能示範，不是醫療建議或正式課綱教材。所有人物與情境均為虛構。",
      "source": "本專案原創虛構情境，供互動功能示範。"
    },
    {
      "id": "choose",
      "eyebrow": "02 / 做一個選擇",
      "title": "如果你是小宇，會先做什麼？",
      "body": "小宇放學後想完成作業、整理明天要用的東西，也想留一些時間休息。他不確定該從哪裡開始。",
      "visual": "cards",
      "bullets": ["需要完成的事", "可以調整的事", "想保留的空間"],
      "activity": {
        "id": "first-step",
        "type": "single",
        "prompt": "哪個做法最能幫助小宇看清楚安排？",
        "options": ["先列出要做的事，再決定先後順序", "所有事情同時做", "完全不看需要完成的事情"],
        "correct": [0],
        "explanation": "先列出事情，有助於比較優先順序。這是情境中的規劃練習。",
        "aiAllowed": false
      },
      "notes": "先收集所有答案，再公布結果。邀請學生說明選擇依據。"
    },
    {
      "id": "factors",
      "eyebrow": "03 / 看見不同因素",
      "title": "好安排，需要哪些資訊？",
      "body": "一個選擇可能有不只一個理由。先找出與這個情境有關的資訊，再討論如何取捨。",
      "visual": "steps",
      "bullets": ["辨識資訊", "比較限制", "形成方案"],
      "activity": {
        "id": "relevant-factors",
        "type": "multiple",
        "prompt": "哪些資訊有助於安排？可以選擇多項。",
        "options": [
          "各項事情大約需要的時間",
          "哪些事情有截止時間",
          "喜歡的鉛筆盒顏色",
          "可以尋求的協助"
        ],
        "correct": [0, 1, 3],
        "explanation": "時間、期限和可用協助，都能幫助形成可執行的安排。",
        "aiAllowed": false
      }
    },
    {
      "id": "scale",
      "eyebrow": "04 / 用量尺表達",
      "title": "這個方案，有多容易執行？",
      "body": "小宇先完成明天要交的作業，再整理用品，並為休息留下一段時間。請評估這個虛構方案。",
      "visual": "balance",
      "activity": {
        "id": "plan-scale",
        "type": "scale",
        "prompt": "你覺得這個方案有多容易執行？這題沒有標準答案。",
        "min": 1,
        "max": 5,
        "minLabel": "還需要調整",
        "maxLabel": "很容易執行",
        "sensitive": false,
        "aiAllowed": false
      }
    },
    {
      "id": "reason",
      "eyebrow": "05 / 讓想法被聽見",
      "title": "給小宇一句有理由的建議。",
      "body": "試著用「我建議……，因為……」說明你的想法。請不要填寫自己或他人的健康、家庭或其他私密資料。",
      "visual": "cards",
      "bullets": ["說明選擇", "提出理由", "尊重不同想法"],
      "activity": {
        "id": "advice",
        "type": "short",
        "prompt": "你會給小宇什麼建議？請寫 1–2 句話。",
        "sensitive": false,
        "aiAllowed": true
      },
      "notes": "AI 僅提供分類草稿。教師應核對原始回答後，再決定如何回饋。"
    },
    {
      "id": "custom",
      "eyebrow": "06 / 自訂互動元件",
      "title": "教材也能有自己的互動方式。",
      "body": "下方是被隔離的 HTML 小元件。學生按下按鈕後，仍由框架統一接收和保存答案。",
      "activity": {
        "id": "custom-choice",
        "type": "single",
        "prompt": "選一個規劃步驟。此題用來展示自訂 HTML 提交。",
        "options": ["觀察", "比較", "調整"],
        "aiAllowed": false
      },
      "customHtml": "<style>body{font-family:system-ui;color:#173b38;margin:12px}p{font-size:17px}nav{display:flex;gap:12px;flex-wrap:wrap}button{font:inherit;font-size:20px;min-height:58px;padding:10px 24px;border:1px solid #bad0c8;border-radius:16px;background:#e7f0e9;color:#173b38;cursor:pointer}button:focus{outline:3px solid #dc8c68}</style><p>把你的想法，放進一個步驟。</p><nav><button onclick=\"send(0)\">① 觀察</button><button onclick=\"send(1)\">② 比較</button><button onclick=\"send(2)\">③ 調整</button></nav><p id=\"hint\" aria-live=\"polite\">由教師開放作答後，學生可以提交。</p><script>function send(i){parent.postMessage({type:'health-classroom:submit',activityId:'custom-choice',value:i},'*')}addEventListener('message',e=>{if(e.data.type==='health-classroom:state'){document.querySelectorAll('button').forEach(b=>b.disabled=e.data.role!=='student'||!e.data.open)}});parent.postMessage({type:'health-classroom:ready'},'*');</script>"
    },
    {
      "id": "finish",
      "eyebrow": "07 / 帶走一個方法",
      "title": "觀察 → 比較 → 調整。",
      "body": "今天練習的不是找出每個人都相同的答案，而是讓選擇有理由，也保留調整的空間。",
      "bullets": ["看清楚情境中的資訊", "說明自己的選擇依據", "聽見不同觀點後再調整"],
      "visual": "steps",
      "notes": "可開啟抽籤邀請學生分享，或使用白板整理共同觀點。"
    }
  ]
}
